{
  "schema_version": "lsc.feature_spec.v1",
  "feature_version": "features_v1",
  "point_order": [
    "pose_0",
    "pose_11",
    "pose_12",
    "pose_13",
    "pose_14",
    "pose_15",
    "pose_16",
    "lh_0",
    "lh_1",
    "lh_2",
    "lh_3",
    "lh_4",
    "lh_5",
    "lh_6",
    "lh_7",
    "lh_8",
    "lh_9",
    "lh_10",
    "lh_11",
    "lh_12",
    "lh_13",
    "lh_14",
    "lh_15",
    "lh_16",
    "lh_17",
    "lh_18",
    "lh_19",
    "lh_20",
    "rh_0",
    "rh_1",
    "rh_2",
    "rh_3",
    "rh_4",
    "rh_5",
    "rh_6",
    "rh_7",
    "rh_8",
    "rh_9",
    "rh_10",
    "rh_11",
    "rh_12",
    "rh_13",
    "rh_14",
    "rh_15",
    "rh_16",
    "rh_17",
    "rh_18",
    "rh_19",
    "rh_20"
  ],
  "coordinate_system": "shoulder_normalized_2d",
  "temporal_length": 6,
  "features_per_frame": 147,
  "dtype": "float32",
  "missing_policy": {
    "interpolate": false,
    "mirror": false,
    "clip": false,
    "absent_triple": [
      0.0,
      0.0,
      0.0
    ]
  },
  "quality_rules": {
    "use_presence": false,
    "visibility_threshold": 0.5,
    "presence_threshold": 0.5,
    "min_shoulder_distance_frac_width": 0.08,
    "min_valid_shoulder_frames": 5,
    "min_hand_frames": 4,
    "max_people": 1,
    "geometry_outlier_abs": 10.0,
    "hand_association_cost_max": 0.6,
    "hand_association_ambiguous_gap": 0.05
  },
  "detector_versions": {
    "pose": null,
    "hands": null
  },
  "model_asset_hashes": {
    "pose": null,
    "hands": null
  },
  "normalization": {
    "center": "median_of_shoulder_midpoints",
    "scale": "median_of_shoulder_distances",
    "y_positive": "down",
    "mask_channel": "point_presence_binary"
  },
  "build_date": null,
  "feature_spec_hash": "abecec4bae7d2fa5a23d29c3b76fe74369f8a296bb8afe418e35f4a1d9eb4fc9"
}
